"No.","Time","Source","Destination","Protocol","Length","Info"
"1","0.000000","192.168.1.1","172.23.69.13","TCP","2968","80 → 50034 [ACK] Seq=1 Ack=1 Win=1005 Len=2896 TSval=867137389 TSecr=2681674572"
"27","0.033732","192.168.1.1","172.23.69.13","TCP","2968","80 → 50034 [ACK] Seq=77913 Ack=1 Win=1005 Len=2896 TSval=867137423 TSecr=2681674607"
"79","0.065522","192.168.1.1","172.23.69.13","TCP","2968","80 → 50034 [ACK] Seq=155825 Ack=1 Win=1005 Len=2896 TSval=867137455 TSecr=2681674637"
"134","0.100041","192.168.1.1","172.23.69.13","TCP","2968","80 → 50034 [ACK] Seq=233737 Ack=1 Win=1005 Len=2896 TSval=867137489 TSecr=2681674669"
"193","0.136404","192.168.1.1","172.23.69.13","TCP","2728","80 → 50034 [PSH, ACK] Seq=308993 Ack=1 Win=1005 Len=2656 TSval=867137523 TSecr=2681674703"
"213","0.167394","192.168.1.1","172.23.69.13","TCP","1520","80 → 50034 [ACK] Seq=388353 Ack=1 Win=1005 Len=1448 TSval=867137556 TSecr=2681674749"
"231","0.200029","192.168.1.1","172.23.69.13","TCP","4416","80 → 50034 [ACK] Seq=463369 Ack=1 Win=1005 Len=4344 TSval=867137589 TSecr=2681674777"
"283","0.234133","192.168.1.1","172.23.69.13","TCP","2968","80 → 50034 [ACK] Seq=541281 Ack=1 Win=1005 Len=2896 TSval=867137623 TSecr=2681674803"
"325","0.266209","192.168.1.1","172.23.69.13","TCP","2968","80 → 50034 [ACK] Seq=619193 Ack=1 Win=1005 Len=2896 TSval=867137655 TSecr=2681674838"
"378","0.299475","192.168.1.1","172.23.69.13","TCP","2968","80 → 50034 [ACK] Seq=697105 Ack=1 Win=1005 Len=2896 TSval=867137689 TSecr=2681674871"
"429","0.333754","192.168.1.1","172.23.69.13","TCP","6824","80 → 50034 [PSH, ACK] Seq=772361 Ack=1 Win=1005 Len=6752 TSval=867137722 TSecr=2681674902"
"477","0.369508","192.168.1.1","172.23.69.13","TCP","8272","80 → 50034 [PSH, ACK] Seq=848825 Ack=1 Win=1005 Len=8200 TSval=867137758 TSecr=2681674936"
"517","0.400732","192.168.1.1","172.23.69.13","TCP","2968","80 → 50034 [ACK] Seq=926737 Ack=1 Win=1005 Len=2896 TSval=867137790 TSecr=2681674973"
"579","0.432618","192.168.1.1","172.23.69.13","TCP","2968","80 → 50034 [ACK] Seq=1004649 Ack=1 Win=1005 Len=2896 TSval=867137822 TSecr=2681675008"
"623","0.465941","192.168.1.1","172.23.69.13","TCP","2968","80 → 50034 [ACK] Seq=1082561 Ack=1 Win=1005 Len=2896 TSval=867137855 TSecr=2681675038"
"685","0.500155","192.168.1.1","172.23.69.13","TCP","2968","80 → 50034 [ACK] Seq=1160473 Ack=1 Win=1005 Len=2896 TSval=867137889 TSecr=2681675069"
"711","0.532351","192.168.1.1","172.23.69.13","TCP","2968","80 → 50034 [ACK] Seq=1238385 Ack=1 Win=1005 Len=2896 TSval=867137921 TSecr=2681675105"
"745","0.565658","192.168.1.1","172.23.69.13","TCP","4416","80 → 50034 [ACK] Seq=1312193 Ack=1 Win=1005 Len=4344 TSval=867137955 TSecr=2681675138"
"788","0.598945","192.168.1.1","172.23.69.13","TCP","4416","80 → 50034 [ACK] Seq=1390105 Ack=1 Win=1005 Len=4344 TSval=867137988 TSecr=2681675169"
"837","0.633954","192.168.1.1","172.23.69.13","TCP","2968","80 → 50034 [ACK] Seq=1468017 Ack=1 Win=1005 Len=2896 TSval=867138023 TSecr=2681675202"
"888","0.665623","192.168.1.1","172.23.69.13","TCP","2968","80 → 50034 [ACK] Seq=1545929 Ack=1 Win=1005 Len=2896 TSval=867138055 TSecr=2681675237"
"928","0.700327","192.168.1.1","172.23.69.13","TCP","4416","80 → 50034 [ACK] Seq=1623841 Ack=1 Win=1005 Len=4344 TSval=867138089 TSecr=2681675269"
"990","0.732348","192.168.1.1","172.23.69.13","TCP","4416","80 → 50034 [ACK] Seq=1701753 Ack=1 Win=1005 Len=4344 TSval=867138121 TSecr=2681675303"
"1016","0.769624","192.168.1.1","172.23.69.13","TCP","8272","80 → 50034 [PSH, ACK] Seq=1779665 Ack=1 Win=1005 Len=8200 TSval=867138155 TSecr=2681675337"
"1035","0.799892","192.168.1.1","172.23.69.13","TCP","4416","80 → 50034 [ACK] Seq=1853473 Ack=1 Win=1005 Len=4344 TSval=867138189 TSecr=2681675371"
"1071","0.832993","192.168.1.1","172.23.69.13","TCP","4416","80 → 50034 [ACK] Seq=1934281 Ack=1 Win=1005 Len=4344 TSval=867138222 TSecr=2681675404"
"1102","0.866898","192.168.1.1","172.23.69.13","TCP","2968","80 → 50034 [ACK] Seq=2009297 Ack=1 Win=1005 Len=2896 TSval=867138256 TSecr=2681675438"
"1140","0.902006","192.168.1.1","172.23.69.13","TCP","2968","80 → 50034 [ACK] Seq=2088657 Ack=1 Win=1005 Len=2896 TSval=867138291 TSecr=2681675470"
"1179","0.935714","192.168.1.1","172.23.69.13","TCP","1520","80 → 50034 [ACK] Seq=2165121 Ack=1 Win=1005 Len=1448 TSval=867138325 TSecr=2681675505"
"1211","0.965935","192.168.1.1","172.23.69.13","TCP","2968","80 → 50034 [ACK] Seq=2243033 Ack=1 Win=1005 Len=2896 TSval=867138355 TSecr=2681675539"
"1233","0.999005","192.168.1.1","172.23.69.13","TCP","1520","80 → 50034 [ACK] Seq=2319737 Ack=1 Win=1005 Len=1448 TSval=867138388 TSecr=2681675570"
"1307","1.033538","192.168.1.1","172.23.69.13","TCP","5376","80 → 50034 [PSH, ACK] Seq=2397649 Ack=1 Win=1005 Len=5304 TSval=867138422 TSecr=2681675602"
"1364","1.065545","192.168.1.1","172.23.69.13","TCP","2968","80 → 50034 [ACK] Seq=2472665 Ack=1 Win=1005 Len=2896 TSval=867138455 TSecr=2681675636"
"1415","1.098929","192.168.1.1","172.23.69.13","TCP","2968","80 → 50034 [ACK] Seq=2550577 Ack=1 Win=1005 Len=2896 TSval=867138488 TSecr=2681675671"
"1478","1.132196","192.168.1.1","172.23.69.13","TCP","2968","80 → 50034 [ACK] Seq=2628489 Ack=1 Win=1005 Len=2896 TSval=867138521 TSecr=2681675702"
"1530","1.165701","192.168.1.1","172.23.69.13","TCP","2968","80 → 50034 [ACK] Seq=2706401 Ack=1 Win=1005 Len=2896 TSval=867138555 TSecr=2681675736"
"1577","1.198987","192.168.1.1","172.23.69.13","TCP","2968","80 → 50034 [ACK] Seq=2784313 Ack=1 Win=1005 Len=2896 TSval=867138588 TSecr=2681675772"
"1601","1.232398","192.168.1.1","172.23.69.13","TCP","1520","80 → 50034 [ACK] Seq=2861017 Ack=1 Win=1005 Len=1448 TSval=867138621 TSecr=2681675802"
"1667","1.265691","192.168.1.1","172.23.69.13","TCP","1520","80 → 50034 [ACK] Seq=2938929 Ack=1 Win=1005 Len=1448 TSval=867138655 TSecr=2681675836"
"1711","1.298966","192.168.1.1","172.23.69.13","TCP","2968","80 → 50034 [ACK] Seq=3013945 Ack=1 Win=1005 Len=2896 TSval=867138688 TSecr=2681675869"
"1768","1.332820","192.168.1.1","172.23.69.13","TCP","8272","80 → 50034 [PSH, ACK] Seq=3091857 Ack=1 Win=1005 Len=8200 TSval=867138721 TSecr=2681675904"
"1825","1.365651","192.168.1.1","172.23.69.13","TCP","4416","80 → 50034 [ACK] Seq=3169769 Ack=1 Win=1005 Len=4344 TSval=867138755 TSecr=2681675940"
"1893","1.399692","192.168.1.1","172.23.69.13","TCP","8272","80 → 50034 [PSH, ACK] Seq=3247681 Ack=1 Win=1005 Len=8200 TSval=867138788 TSecr=2681675969"
"1942","1.435339","192.168.1.1","172.23.69.13","TCP","8272","80 → 50034 [PSH, ACK] Seq=3325593 Ack=1 Win=1005 Len=8200 TSval=867138821 TSecr=2681676002"
"1963","1.468273","192.168.1.1","172.23.69.13","TCP","8272","80 → 50034 [PSH, ACK] Seq=3399401 Ack=1 Win=1005 Len=8200 TSval=867138855 TSecr=2681676036"
"2006","1.499285","192.168.1.1","172.23.69.13","TCP","5864","80 → 50034 [ACK] Seq=3477313 Ack=1 Win=1005 Len=5792 TSval=867138888 TSecr=2681676069"
"2026","1.532954","192.168.1.1","172.23.69.13","TCP","8272","80 → 50034 [PSH, ACK] Seq=3555225 Ack=1 Win=1005 Len=8200 TSval=867138921 TSecr=2681676106"
"2072","1.565338","192.168.1.1","172.23.69.13","TCP","2968","80 → 50034 [ACK] Seq=3633137 Ack=1 Win=1005 Len=2896 TSval=867138954 TSecr=2681676139"
"2113","1.600217","192.168.1.1","172.23.69.13","TCP","8272","80 → 50034 [PSH, ACK] Seq=3711049 Ack=1 Win=1005 Len=8200 TSval=867138988 TSecr=2681676177"
"2149","1.631946","192.168.1.1","172.23.69.13","TCP","2968","80 → 50034 [ACK] Seq=3788961 Ack=1 Win=1005 Len=2896 TSval=867139021 TSecr=2681676203"
"2205","1.672313","192.168.1.1","172.23.69.13","TCP","8272","80 → 50034 [PSH, ACK] Seq=3862769 Ack=1 Win=1005 Len=8200 TSval=867139054 TSecr=2681676236"
"2216","1.699064","192.168.1.1","172.23.69.13","TCP","4416","80 → 50034 [ACK] Seq=3940681 Ack=1 Win=1005 Len=4344 TSval=867139088 TSecr=2681676269"
"2255","1.733053","192.168.1.1","172.23.69.13","TCP","8272","80 → 50034 [PSH, ACK] Seq=4018593 Ack=1 Win=1005 Len=8200 TSval=867139121 TSecr=2681676306"
"2309","1.770423","192.168.1.1","172.23.69.13","TCP","8272","80 → 50034 [PSH, ACK] Seq=4096505 Ack=1 Win=1005 Len=8200 TSval=867139155 TSecr=2681676336"
"2327","1.800416","192.168.1.1","172.23.69.13","TCP","8272","80 → 50034 [PSH, ACK] Seq=4174417 Ack=1 Win=1005 Len=8200 TSval=867139188 TSecr=2681676370"
"2350","1.837144","192.168.1.1","172.23.69.13","TCP","8272","80 → 50034 [PSH, ACK] Seq=4252329 Ack=1 Win=1005 Len=8200 TSval=867139221 TSecr=2681676408"
"2364","1.872786","192.168.1.1","172.23.69.13","TCP","8272","80 → 50034 [PSH, ACK] Seq=4326137 Ack=1 Win=1005 Len=8200 TSval=867139255 TSecr=2681676437"
"2381","1.899098","192.168.1.1","172.23.69.13","TCP","1520","80 → 50034 [ACK] Seq=4406945 Ack=1 Win=1005 Len=1448 TSval=867139288 TSecr=2681676475"
"2396","1.931770","192.168.1.1","172.23.69.13","TCP","2968","80 → 50034 [ACK] Seq=4481961 Ack=1 Win=1005 Len=2896 TSval=867139321 TSecr=2681676503"
"2440","1.965120","192.168.1.1","172.23.69.13","TCP","2968","80 → 50034 [ACK] Seq=4559873 Ack=1 Win=1005 Len=2896 TSval=867139354 TSecr=2681676535"
"2468","1.998521","192.168.1.1","172.23.69.13","TCP","2968","80 → 50034 [ACK] Seq=4637785 Ack=1 Win=1005 Len=2896 TSval=867139388 TSecr=2681676572"
"2500","2.032186","192.168.1.1","172.23.69.13","TCP","1520","80 → 50034 [ACK] Seq=4715697 Ack=1 Win=1005 Len=1448 TSval=867139421 TSecr=2681676603"
"2531","2.065544","192.168.1.1","172.23.69.13","TCP","2968","80 → 50034 [ACK] Seq=4793609 Ack=1 Win=1005 Len=2896 TSval=867139455 TSecr=2681676636"
"2563","2.099097","192.168.1.1","172.23.69.13","TCP","1520","80 → 50034 [ACK] Seq=4870313 Ack=1 Win=1005 Len=1448 TSval=867139488 TSecr=2681676676"
"2616","2.132085","192.168.1.1","172.23.69.13","TCP","1520","80 → 50034 [ACK] Seq=4948225 Ack=1 Win=1005 Len=1448 TSval=867139521 TSecr=2681676704"
"2654","2.165672","192.168.1.1","172.23.69.13","TCP","2968","80 → 50034 [ACK] Seq=5023241 Ack=1 Win=1005 Len=2896 TSval=867139555 TSecr=2681676735"
"2679","2.199844","192.168.1.1","172.23.69.13","TCP","8272","80 → 50034 [PSH, ACK] Seq=5101153 Ack=1 Win=1005 Len=8200 TSval=867139588 TSecr=2681676769"
"2731","2.232232","192.168.1.1","172.23.69.13","TCP","2968","80 → 50034 [ACK] Seq=5179065 Ack=1 Win=1005 Len=2896 TSval=867139621 TSecr=2681676802"
"2751","2.265365","192.168.1.1","172.23.69.13","TCP","4416","80 → 50034 [ACK] Seq=5256977 Ack=1 Win=1005 Len=4344 TSval=867139654 TSecr=2681676838"
"2800","2.298872","192.168.1.1","172.23.69.13","TCP","1280","80 → 50034 [PSH, ACK] Seq=5333681 Ack=1 Win=1005 Len=1208 TSval=867139687 TSecr=2681676871"
"2827","2.333042","192.168.1.1","172.23.69.13","TCP","1520","80 → 50034 [ACK] Seq=5411593 Ack=1 Win=1005 Len=1448 TSval=867139722 TSecr=2681676902"
"2863","2.366185","192.168.1.1","172.23.69.13","TCP","1520","80 → 50034 [ACK] Seq=5489505 Ack=1 Win=1005 Len=1448 TSval=867139755 TSecr=2681676940"
"2890","2.398835","192.168.1.1","172.23.69.13","TCP","2968","80 → 50034 [ACK] Seq=5564521 Ack=1 Win=1005 Len=2896 TSval=867139788 TSecr=2681676970"
"2936","2.432611","192.168.1.1","172.23.69.13","TCP","5864","80 → 50034 [ACK] Seq=5642433 Ack=1 Win=1005 Len=5792 TSval=867139821 TSecr=2681677003"
"2968","2.465320","192.168.1.1","172.23.69.13","TCP","2968","80 → 50034 [ACK] Seq=5720345 Ack=1 Win=1005 Len=2896 TSval=867139855 TSecr=2681677046"
"2988","2.499896","192.168.1.1","172.23.69.13","TCP","8272","80 → 50034 [PSH, ACK] Seq=5798257 Ack=1 Win=1005 Len=8200 TSval=867139888 TSecr=2681677077"
"3026","2.532210","192.168.1.1","172.23.69.13","TCP","1280","80 → 50034 [PSH, ACK] Seq=5874961 Ack=1 Win=1005 Len=1208 TSval=867139920 TSecr=2681677102"
"3042","2.570140","192.168.1.1","172.23.69.13","TCP","8272","80 → 50034 [PSH, ACK] Seq=5949977 Ack=1 Win=1005 Len=8200 TSval=867139955 TSecr=2681677140"
"3062","2.598814","192.168.1.1","172.23.69.13","TCP","1520","80 → 50034 [ACK] Seq=6030785 Ack=1 Win=1005 Len=1448 TSval=867139988 TSecr=2681677175"
"3112","2.632884","192.168.1.1","172.23.69.13","TCP","4416","80 → 50034 [ACK] Seq=6105801 Ack=1 Win=1005 Len=4344 TSval=867140022 TSecr=2681677202"
"3132","2.665620","192.168.1.1","172.23.69.13","TCP","2968","80 → 50034 [ACK] Seq=6183713 Ack=1 Win=1005 Len=2896 TSval=867140055 TSecr=2681677244"
"3180","2.699221","192.168.1.1","172.23.69.13","TCP","2968","80 → 50034 [ACK] Seq=6261625 Ack=1 Win=1005 Len=2896 TSval=867140088 TSecr=2681677269"
"3201","2.733229","192.168.1.1","172.23.69.13","TCP","4416","80 → 50034 [ACK] Seq=6339537 Ack=1 Win=1005 Len=4344 TSval=867140122 TSecr=2681677303"
"3225","2.766018","192.168.1.1","172.23.69.13","TCP","5376","80 → 50034 [PSH, ACK] Seq=6416241 Ack=1 Win=1005 Len=5304 TSval=867140155 TSecr=2681677337"
"3262","2.799717","192.168.1.1","172.23.69.13","TCP","8272","80 → 50034 [PSH, ACK] Seq=6491257 Ack=1 Win=1005 Len=8200 TSval=867140188 TSecr=2681677371"
"3293","2.832771","192.168.1.1","172.23.69.13","TCP","2968","80 → 50034 [ACK] Seq=6569169 Ack=1 Win=1005 Len=2896 TSval=867140222 TSecr=2681677402"
"3327","2.865723","192.168.1.1","172.23.69.13","TCP","2968","80 → 50034 [ACK] Seq=6647081 Ack=1 Win=1005 Len=2896 TSval=867140255 TSecr=2681677444"
"3372","2.898409","192.168.1.1","172.23.69.13","TCP","1520","80 → 50034 [ACK] Seq=6724993 Ack=1 Win=1005 Len=1448 TSval=867140288 TSecr=2681677469"
"3402","2.932566","192.168.1.1","172.23.69.13","TCP","2968","80 → 50034 [ACK] Seq=6802905 Ack=1 Win=1005 Len=2896 TSval=867140322 TSecr=2681677502"
"3445","2.967634","192.168.1.1","172.23.69.13","TCP","8272","80 → 50034 [PSH, ACK] Seq=6880817 Ack=1 Win=1005 Len=8200 TSval=867140354 TSecr=2681677540"
"3461","2.999079","192.168.1.1","172.23.69.13","TCP","4416","80 → 50034 [ACK] Seq=6957521 Ack=1 Win=1005 Len=4344 TSval=867140388 TSecr=2681677570"
"3483","3.032368","192.168.1.1","172.23.69.13","TCP","1520","80 → 50034 [ACK] Seq=7035433 Ack=1 Win=1005 Len=1448 TSval=867140421 TSecr=2681677607"
"3504","3.065370","192.168.1.1","172.23.69.13","TCP","1520","80 → 50034 [ACK] Seq=7111897 Ack=1 Win=1005 Len=1448 TSval=867140454 TSecr=2681677636"
"3533","3.098883","192.168.1.1","172.23.69.13","TCP","2968","80 → 50034 [ACK] Seq=7188361 Ack=1 Win=1005 Len=2896 TSval=867140488 TSecr=2681677676"
"3579","3.132164","192.168.1.1","172.23.69.13","TCP","2968","80 → 50034 [ACK] Seq=7266273 Ack=1 Win=1005 Len=2896 TSval=867140521 TSecr=2681677702"
"3607","3.170412","192.168.1.1","172.23.69.13","TCP","8272","80 → 50034 [PSH, ACK] Seq=7344185 Ack=1 Win=1005 Len=8200 TSval=867140554 TSecr=2681677743"
"3624","3.204887","192.168.1.1","172.23.69.13","TCP","8272","80 → 50034 [PSH, ACK] Seq=7422097 Ack=1 Win=1005 Len=8200 TSval=867140588 TSecr=2681677775"
"3640","3.232283","192.168.1.1","172.23.69.13","TCP","1520","80 → 50034 [ACK] Seq=7498801 Ack=1 Win=1005 Len=1448 TSval=867140621 TSecr=2681677804"
"3692","3.265679","192.168.1.1","172.23.69.13","TCP","1520","80 → 50034 [ACK] Seq=7576713 Ack=1 Win=1005 Len=1448 TSval=867140655 TSecr=2681677841"
"3721","3.298962","192.168.1.1","172.23.69.13","TCP","2968","80 → 50034 [ACK] Seq=7651729 Ack=1 Win=1005 Len=2896 TSval=867140688 TSecr=2681677872"
"3754","3.332053","192.168.1.1","172.23.69.13","TCP","2968","80 → 50034 [ACK] Seq=7729641 Ack=1 Win=1005 Len=2896 TSval=867140721 TSecr=2681677903"
"3787","3.365921","192.168.1.1","172.23.69.13","TCP","4416","80 → 50034 [ACK] Seq=7809001 Ack=1 Win=1005 Len=4344 TSval=867140755 TSecr=2681677936"
"3807","3.398399","192.168.1.1","172.23.69.13","TCP","1520","80 → 50034 [ACK] Seq=7885465 Ack=1 Win=1005 Len=1448 TSval=867140787 TSecr=2681677969"
"3835","3.431994","192.168.1.1","172.23.69.13","TCP","2968","80 → 50034 [ACK] Seq=7963377 Ack=1 Win=1005 Len=2896 TSval=867140821 TSecr=2681678004"
"3885","3.465522","192.168.1.1","172.23.69.13","TCP","1520","80 → 50034 [ACK] Seq=8040081 Ack=1 Win=1005 Len=1448 TSval=867140855 TSecr=2681678039"
"3906","3.499099","192.168.1.1","172.23.69.13","TCP","1520","80 → 50034 [ACK] Seq=8117993 Ack=1 Win=1005 Len=1448 TSval=867140888 TSecr=2681678070"
"3938","3.532154","192.168.1.1","172.23.69.13","TCP","1520","80 → 50034 [ACK] Seq=8194457 Ack=1 Win=1005 Len=1448 TSval=867140921 TSecr=2681678105"
"3958","3.565223","192.168.1.1","172.23.69.13","TCP","2968","80 → 50034 [ACK] Seq=8270921 Ack=1 Win=1005 Len=2896 TSval=867140954 TSecr=2681678136"
"3988","3.604516","192.168.1.1","172.23.69.13","TCP","8272","80 → 50034 [PSH, ACK] Seq=8348833 Ack=1 Win=1005 Len=8200 TSval=867140988 TSecr=2681678172"
"4003","3.631887","192.168.1.1","172.23.69.13","TCP","2968","80 → 50034 [ACK] Seq=8426745 Ack=1 Win=1005 Len=2896 TSval=867141021 TSecr=2681678208"
"4022","3.665248","192.168.1.1","172.23.69.13","TCP","1520","80 → 50034 [ACK] Seq=8504657 Ack=1 Win=1005 Len=1448 TSval=867141054 TSecr=2681678241"
"4054","3.700108","192.168.1.1","172.23.69.13","TCP","5376","80 → 50034 [PSH, ACK] Seq=8581361 Ack=1 Win=1005 Len=5304 TSval=867141088 TSecr=2681678269"
"4071","3.732487","192.168.1.1","172.23.69.13","TCP","7312","80 → 50034 [ACK] Seq=8656377 Ack=1 Win=1005 Len=7240 TSval=867141121 TSecr=2681678307"
"4097","3.765489","192.168.1.1","172.23.69.13","TCP","2968","80 → 50034 [ACK] Seq=8734289 Ack=1 Win=1005 Len=2896 TSval=867141155 TSecr=2681678336"
"4127","3.799117","192.168.1.1","172.23.69.13","TCP","5864","80 → 50034 [ACK] Seq=8812201 Ack=1 Win=1005 Len=5792 TSval=867141188 TSecr=2681678369"
"4167","3.836348","192.168.1.1","172.23.69.13","TCP","8272","80 → 50034 [PSH, ACK] Seq=8890113 Ack=1 Win=1005 Len=8200 TSval=867141221 TSecr=2681678410"
"4189","3.865178","192.168.1.1","172.23.69.13","TCP","4416","80 → 50034 [ACK] Seq=8968025 Ack=1 Win=1005 Len=4344 TSval=867141254 TSecr=2681678437"
"4207","3.902939","192.168.1.1","172.23.69.13","TCP","4176","80 → 50034 [PSH, ACK] Seq=9041833 Ack=1 Win=1005 Len=4104 TSval=867141287 TSecr=2681678471"
"4223","3.936335","192.168.1.1","172.23.69.13","TCP","8272","80 → 50034 [PSH, ACK] Seq=9119745 Ack=1 Win=1005 Len=8200 TSval=867141321 TSecr=2681678503"
"4245","3.966137","192.168.1.1","172.23.69.13","TCP","8272","80 → 50034 [PSH, ACK] Seq=9197657 Ack=1 Win=1005 Len=8200 TSval=867141355 TSecr=2681678539"
"4266","3.998464","192.168.1.1","172.23.69.13","TCP","2968","80 → 50034 [ACK] Seq=9275569 Ack=1 Win=1005 Len=2896 TSval=867141388 TSecr=2681678572"
"4306","4.032353","192.168.1.1","172.23.69.13","TCP","5864","80 → 50034 [ACK] Seq=9354929 Ack=1 Win=1005 Len=5792 TSval=867141421 TSecr=2681678602"
"4323","4.066350","192.168.1.1","172.23.69.13","TCP","8272","80 → 50034 [PSH, ACK] Seq=9431393 Ack=1 Win=1005 Len=8200 TSval=867141455 TSecr=2681678641"
"4336","4.104907","192.168.1.1","172.23.69.13","TCP","8272","80 → 50034 [PSH, ACK] Seq=9509305 Ack=1 Win=1005 Len=8200 TSval=867141488 TSecr=2681678684"
"4357","4.132206","192.168.1.1","172.23.69.13","TCP","1520","80 → 50034 [ACK] Seq=9586009 Ack=1 Win=1005 Len=1448 TSval=867141521 TSecr=2681678703"
"4380","4.168405","192.168.1.1","172.23.69.13","TCP","8272","80 → 50034 [PSH, ACK] Seq=9661025 Ack=1 Win=1005 Len=8200 TSval=867141555 TSecr=2681678738"
"4400","4.200845","192.168.1.1","172.23.69.13","TCP","8272","80 → 50034 [PSH, ACK] Seq=9738937 Ack=1 Win=1005 Len=8200 TSval=867141588 TSecr=2681678769"
"4418","4.241373","192.168.1.1","172.23.69.13","TCP","8272","80 → 50034 [PSH, ACK] Seq=9816849 Ack=1 Win=1005 Len=8200 TSval=867141621 TSecr=2681678813"
"4433","4.265577","192.168.1.1","172.23.69.13","TCP","8272","80 → 50034 [PSH, ACK] Seq=9894761 Ack=1 Win=1005 Len=8200 TSval=867141654 TSecr=2681678847"
"4449","4.298966","192.168.1.1","172.23.69.13","TCP","2968","80 → 50034 [ACK] Seq=9972673 Ack=1 Win=1005 Len=2896 TSval=867141688 TSecr=2681678876"
"4463","4.338957","192.168.1.1","172.23.69.13","TCP","8272","80 → 50034 [PSH, ACK] Seq=10050585 Ack=1 Win=1005 Len=8200 TSval=867141721 TSecr=2681678903"
"4478","4.371822","192.168.1.1","172.23.69.13","TCP","8272","80 → 50034 [PSH, ACK] Seq=10124393 Ack=1 Win=1005 Len=8200 TSval=867141755 TSecr=2681678945"
"4493","4.400181","192.168.1.1","172.23.69.13","TCP","2968","80 → 50034 [ACK] Seq=10202305 Ack=1 Win=1005 Len=2896 TSval=867141788 TSecr=2681678990"
"4505","4.432868","192.168.1.1","172.23.69.13","TCP","7312","80 → 50034 [ACK] Seq=10280217 Ack=1 Win=1005 Len=7240 TSval=867141821 TSecr=2681679004"
"4524","4.466730","192.168.1.1","172.23.69.13","TCP","8272","80 → 50034 [PSH, ACK] Seq=10358129 Ack=1 Win=1005 Len=8200 TSval=867141854 TSecr=2681679049"
"4550","4.499585","192.168.1.1","172.23.69.13","TCP","8272","80 → 50034 [PSH, ACK] Seq=10436041 Ack=1 Win=1005 Len=8200 TSval=867141888 TSecr=2681679070"
"4569","4.535266","192.168.1.1","172.23.69.13","TCP","8272","80 → 50034 [PSH, ACK] Seq=10513953 Ack=1 Win=1005 Len=8200 TSval=867141921 TSecr=2681679106"
"4596","4.568634","192.168.1.1","172.23.69.13","TCP","8272","80 → 50034 [PSH, ACK] Seq=10587761 Ack=1 Win=1005 Len=8200 TSval=867141955 TSecr=2681679135"
"4607","4.601205","192.168.1.1","172.23.69.13","TCP","8272","80 → 50034 [PSH, ACK] Seq=10665673 Ack=1 Win=1005 Len=8200 TSval=867141988 TSecr=2681679171"
"4624","4.634057","192.168.1.1","172.23.69.13","TCP","8272","80 → 50034 [PSH, ACK] Seq=10743585 Ack=1 Win=1005 Len=8200 TSval=867142021 TSecr=2681679206"
"4635","4.668861","192.168.1.1","172.23.69.13","TCP","8272","80 → 50034 [PSH, ACK] Seq=10821497 Ack=1 Win=1005 Len=8200 TSval=867142055 TSecr=2681679240"
"4651","4.701292","192.168.1.1","172.23.69.13","TCP","8272","80 → 50034 [PSH, ACK] Seq=10899409 Ack=1 Win=1005 Len=8200 TSval=867142088 TSecr=2681679281"
"4679","4.732354","192.168.1.1","172.23.69.13","TCP","1520","80 → 50034 [ACK] Seq=10977321 Ack=1 Win=1005 Len=1448 TSval=867142121 TSecr=2681679308"
"4691","4.772648","192.168.1.1","172.23.69.13","TCP","8272","80 → 50034 [PSH, ACK] Seq=11055233 Ack=1 Win=1005 Len=8200 TSval=867142155 TSecr=2681679338"
"4704","4.802706","192.168.1.1","172.23.69.13","TCP","8272","80 → 50034 [PSH, ACK] Seq=11129041 Ack=1 Win=1005 Len=8200 TSval=867142189 TSecr=2681679384"
"4716","4.843618","192.168.1.1","172.23.69.13","TCP","8272","80 → 50034 [PSH, ACK] Seq=11206953 Ack=1 Win=1005 Len=8200 TSval=867142222 TSecr=2681679403"
"4729","4.867434","192.168.1.1","172.23.69.13","TCP","8272","80 → 50034 [PSH, ACK] Seq=11284865 Ack=1 Win=1005 Len=8200 TSval=867142256 TSecr=2681679441"
"4762","4.898912","192.168.1.1","172.23.69.13","TCP","1520","80 → 50034 [ACK] Seq=11364225 Ack=1 Win=1005 Len=1448 TSval=867142288 TSecr=2681679485"
"4782","4.934608","192.168.1.1","172.23.69.13","TCP","8272","80 → 50034 [PSH, ACK] Seq=11440689 Ack=1 Win=1005 Len=8200 TSval=867142322 TSecr=2681679508"
"4805","4.980608","192.168.1.1","172.23.69.13","TCP","8272","80 → 50034 [PSH, ACK] Seq=11518601 Ack=1 Win=1005 Len=8200 TSval=867142357 TSecr=2681679559"
"4815","5.006528","192.168.1.1","172.23.69.13","TCP","8272","80 → 50034 [PSH, ACK] Seq=11596513 Ack=1 Win=1005 Len=8200 TSval=867142389 TSecr=2681679579"
"4829","5.032513","192.168.1.1","172.23.69.13","TCP","5864","80 → 50034 [ACK] Seq=11670321 Ack=1 Win=1005 Len=5792 TSval=867142421 TSecr=2681679614"
"4846","5.068716","192.168.1.1","172.23.69.13","TCP","8272","80 → 50034 [PSH, ACK] Seq=11748233 Ack=1 Win=1005 Len=8200 TSval=867142455 TSecr=2681679651"
"4862","5.109949","192.168.1.1","172.23.69.13","TCP","8272","80 → 50034 [PSH, ACK] Seq=11826145 Ack=1 Win=1005 Len=8200 TSval=867142488 TSecr=2681679677"
"4878","5.142955","192.168.1.1","172.23.69.13","TCP","8272","80 → 50034 [PSH, ACK] Seq=11904057 Ack=1 Win=1005 Len=8200 TSval=867142523 TSecr=2681679709"
"4889","5.167269","192.168.1.1","172.23.69.13","TCP","8272","80 → 50034 [PSH, ACK] Seq=11981969 Ack=1 Win=1005 Len=8200 TSval=867142555 TSecr=2681679741"
"4904","5.200810","192.168.1.1","172.23.69.13","TCP","8272","80 → 50034 [PSH, ACK] Seq=12059881 Ack=1 Win=1005 Len=8200 TSval=867142588 TSecr=2681679779"
"4926","5.232790","192.168.1.1","172.23.69.13","TCP","8272","80 → 50034 [PSH, ACK] Seq=12137793 Ack=1 Win=1005 Len=8200 TSval=867142621 TSecr=2681679821"
"4941","5.267171","192.168.1.1","172.23.69.13","TCP","8272","80 → 50034 [PSH, ACK] Seq=12211601 Ack=1 Win=1005 Len=8200 TSval=867142655 TSecr=2681679848"
"4961","5.311833","192.168.1.1","172.23.69.13","TCP","8272","80 → 50034 [PSH, ACK] Seq=12289513 Ack=1 Win=1005 Len=8200 TSval=867142688 TSecr=2681679877"
"4973","5.332723","192.168.1.1","172.23.69.13","TCP","5864","80 → 50034 [ACK] Seq=12367425 Ack=1 Win=1005 Len=5792 TSval=867142721 TSecr=2681679909"
"4986","5.375341","192.168.1.1","172.23.69.13","TCP","8272","80 → 50034 [PSH, ACK] Seq=12445337 Ack=1 Win=1005 Len=8200 TSval=867142756 TSecr=2681679941"
"5001","5.406996","192.168.1.1","172.23.69.13","TCP","8272","80 → 50034 [PSH, ACK] Seq=12523249 Ack=1 Win=1005 Len=8200 TSval=867142789 TSecr=2681679988"
"5016","5.432128","192.168.1.1","172.23.69.13","TCP","1520","80 → 50034 [ACK] Seq=12601161 Ack=1 Win=1005 Len=1448 TSval=867142821 TSecr=2681680013"
"5033","5.473619","192.168.1.1","172.23.69.13","TCP","8272","80 → 50034 [PSH, ACK] Seq=12679073 Ack=1 Win=1005 Len=8200 TSval=867142855 TSecr=2681680041"
"5049","5.508899","192.168.1.1","172.23.69.13","TCP","8272","80 → 50034 [PSH, ACK] Seq=12752881 Ack=1 Win=1005 Len=8200 TSval=867142889 TSecr=2681680094"
"5067","5.544321","192.168.1.1","172.23.69.13","TCP","8272","80 → 50034 [PSH, ACK] Seq=12830793 Ack=1 Win=1005 Len=8200 TSval=867142921 TSecr=2681680126"
"5082","5.570570","192.168.1.1","172.23.69.13","TCP","8272","80 → 50034 [PSH, ACK] Seq=12908705 Ack=1 Win=1005 Len=8200 TSval=867142955 TSecr=2681680143"
"5095","5.599000","192.168.1.1","172.23.69.13","TCP","2968","80 → 50034 [ACK] Seq=12986617 Ack=1 Win=1005 Len=2896 TSval=867142988 TSecr=2681680174"
"5117","5.638912","192.168.1.1","172.23.69.13","TCP","8272","80 → 50034 [PSH, ACK] Seq=13064529 Ack=1 Win=1005 Len=8200 TSval=867143023 TSecr=2681680211"
"5133","5.676941","192.168.1.1","172.23.69.13","TCP","8272","80 → 50034 [PSH, ACK] Seq=13142441 Ack=1 Win=1005 Len=8200 TSval=867143055 TSecr=2681680252"
"5151","5.699276","192.168.1.1","172.23.69.13","TCP","4416","80 → 50034 [ACK] Seq=13220353 Ack=1 Win=1005 Len=4344 TSval=867143088 TSecr=2681680277"
"5167","5.734883","192.168.1.1","172.23.69.13","TCP","8272","80 → 50034 [PSH, ACK] Seq=13294161 Ack=1 Win=1005 Len=8200 TSval=867143121 TSecr=2681680306"
"5184","5.774110","192.168.1.1","172.23.69.13","TCP","8272","80 → 50034 [PSH, ACK] Seq=13372073 Ack=1 Win=1005 Len=8200 TSval=867143157 TSecr=2681680342"
"5201","5.801126","192.168.1.1","172.23.69.13","TCP","4416","80 → 50034 [ACK] Seq=13449985 Ack=1 Win=1005 Len=4344 TSval=867143190 TSecr=2681680388"
"5220","5.838099","192.168.1.1","172.23.69.13","TCP","8272","80 → 50034 [PSH, ACK] Seq=13527897 Ack=1 Win=1005 Len=8200 TSval=867143223 TSecr=2681680419"
"5235","5.866259","192.168.1.1","172.23.69.13","TCP","4416","80 → 50034 [ACK] Seq=13605809 Ack=1 Win=1005 Len=4344 TSval=867143255 TSecr=2681680440"
"5260","5.902618","192.168.1.1","172.23.69.13","TCP","4416","80 → 50034 [ACK] Seq=13683721 Ack=1 Win=1005 Len=4344 TSval=867143292 TSecr=2681680470"
"5276","5.936670","192.168.1.1","172.23.69.13","TCP","8272","80 → 50034 [PSH, ACK] Seq=13757529 Ack=1 Win=1005 Len=8200 TSval=867143324 TSecr=2681680514"
"5298","5.973415","192.168.1.1","172.23.69.13","TCP","6824","80 → 50034 [PSH, ACK] Seq=13836889 Ack=1 Win=1005 Len=6752 TSval=867143355 TSecr=2681680540"
"5314","5.997209","192.168.1.1","172.23.69.13","TCP","2968","80 → 50034 [ACK] Seq=13913353 Ack=1 Win=1005 Len=2896 TSval=867143386 TSecr=2681680573"
"5337","6.033167","192.168.1.1","172.23.69.13","TCP","8272","80 → 50034 [PSH, ACK] Seq=13991265 Ack=1 Win=1005 Len=8200 TSval=867143420 TSecr=2681680612"
"5355","6.071674","192.168.1.1","172.23.69.13","TCP","8272","80 → 50034 [PSH, ACK] Seq=14069177 Ack=1 Win=1005 Len=8200 TSval=867143453 TSecr=2681680643"
"5365","6.118801","192.168.1.1","172.23.69.13","TCP","8272","80 → 50034 [PSH, ACK] Seq=14147089 Ack=1 Win=1005 Len=8200 TSval=867143486 TSecr=2681680669"
"5376","6.136301","192.168.1.1","172.23.69.13","TCP","8272","80 → 50034 [PSH, ACK] Seq=14225001 Ack=1 Win=1005 Len=8200 TSval=867143520 TSecr=2681680716"
"5389","6.172942","192.168.1.1","172.23.69.13","TCP","8272","80 → 50034 [PSH, ACK] Seq=14298809 Ack=1 Win=1005 Len=8200 TSval=867143553 TSecr=2681680746"
"5400","6.199349","192.168.1.1","172.23.69.13","TCP","8272","80 → 50034 [PSH, ACK] Seq=14376721 Ack=1 Win=1005 Len=8200 TSval=867143586 TSecr=2681680770"
"5418","6.236822","192.168.1.1","172.23.69.13","TCP","8272","80 → 50034 [PSH, ACK] Seq=14454633 Ack=1 Win=1005 Len=8200 TSval=867143620 TSecr=2681680818"
"5429","6.263885","192.168.1.1","172.23.69.13","TCP","2968","80 → 50034 [ACK] Seq=14532545 Ack=1 Win=1005 Len=2896 TSval=867143653 TSecr=2681680834"
"5461","6.302774","192.168.1.1","172.23.69.13","TCP","8272","80 → 50034 [PSH, ACK] Seq=14610457 Ack=1 Win=1005 Len=8200 TSval=867143686 TSecr=2681680875"
"5477","6.330762","192.168.1.1","172.23.69.13","TCP","5864","80 → 50034 [ACK] Seq=14688369 Ack=1 Win=1005 Len=5792 TSval=867143719 TSecr=2681680910"
"5498","6.364458","192.168.1.1","172.23.69.13","TCP","4176","80 → 50034 [PSH, ACK] Seq=14762177 Ack=1 Win=1005 Len=4104 TSval=867143753 TSecr=2681680952"
"5527","6.397849","192.168.1.1","172.23.69.13","TCP","8272","80 → 50034 [PSH, ACK] Seq=14840089 Ack=1 Win=1005 Len=8200 TSval=867143786 TSecr=2681680989"
"5541","6.432282","192.168.1.1","172.23.69.13","TCP","8272","80 → 50034 [PSH, ACK] Seq=14918001 Ack=1 Win=1005 Len=8200 TSval=867143820 TSecr=2681681006"
"5552","6.464226","192.168.1.1","172.23.69.13","TCP","4416","80 → 50034 [ACK] Seq=14995913 Ack=1 Win=1005 Len=4344 TSval=867143853 TSecr=2681681041"
"5571","6.503962","192.168.1.1","172.23.69.13","TCP","8272","80 → 50034 [PSH, ACK] Seq=15073825 Ack=1 Win=1005 Len=8200 TSval=867143886 TSecr=2681681088"
"5589","6.543625","192.168.1.1","172.23.69.13","TCP","8272","80 → 50034 [PSH, ACK] Seq=15151737 Ack=1 Win=1005 Len=8200 TSval=867143919 TSecr=2681681101"
"5605","6.567118","192.168.1.1","172.23.69.13","TCP","8272","80 → 50034 [PSH, ACK] Seq=15229649 Ack=1 Win=1005 Len=8200 TSval=867143953 TSecr=2681681142"
"5619","6.597029","192.168.1.1","172.23.69.13","TCP","4416","80 → 50034 [ACK] Seq=15307561 Ack=1 Win=1005 Len=4344 TSval=867143986 TSecr=2681681171"
"5643","6.630502","192.168.1.1","172.23.69.13","TCP","4416","80 → 50034 [ACK] Seq=15381369 Ack=1 Win=1005 Len=4344 TSval=867144019 TSecr=2681681203"
"5665","6.669957","192.168.1.1","172.23.69.13","TCP","8272","80 → 50034 [PSH, ACK] Seq=15459281 Ack=1 Win=1005 Len=8200 TSval=867144054 TSecr=2681681250"
"5678","6.700762","192.168.1.1","172.23.69.13","TCP","8272","80 → 50034 [PSH, ACK] Seq=15537193 Ack=1 Win=1005 Len=8200 TSval=867144088 TSecr=2681681271"
"5696","6.733761","192.168.1.1","172.23.69.13","TCP","8272","80 → 50034 [PSH, ACK] Seq=15615105 Ack=1 Win=1005 Len=8200 TSval=867144121 TSecr=2681681324"
"5715","6.772832","192.168.1.1","172.23.69.13","TCP","8272","80 → 50034 [PSH, ACK] Seq=15693017 Ack=1 Win=1005 Len=8200 TSval=867144155 TSecr=2681681341"
"5731","6.798757","192.168.1.1","172.23.69.13","TCP","2968","80 → 50034 [ACK] Seq=15770929 Ack=1 Win=1005 Len=2896 TSval=867144188 TSecr=2681681371"
"5751","6.832319","192.168.1.1","172.23.69.13","TCP","1520","80 → 50034 [ACK] Seq=15847633 Ack=1 Win=1005 Len=1448 TSval=867144221 TSecr=2681681403"
"5768","6.866571","192.168.1.1","172.23.69.13","TCP","4416","80 → 50034 [ACK] Seq=15922649 Ack=1 Win=1005 Len=4344 TSval=867144256 TSecr=2681681445"
"5792","6.898798","192.168.1.1","172.23.69.13","TCP","4416","80 → 50034 [ACK] Seq=16000561 Ack=1 Win=1005 Len=4344 TSval=867144288 TSecr=2681681470"
"5808","6.932331","192.168.1.1","172.23.69.13","TCP","2968","80 → 50034 [ACK] Seq=16078473 Ack=1 Win=1005 Len=2896 TSval=867144321 TSecr=2681681514"
"5834","6.965959","192.168.1.1","172.23.69.13","TCP","1520","80 → 50034 [ACK] Seq=16156385 Ack=1 Win=1005 Len=1448 TSval=867144355 TSecr=2681681536"
"5852","7.009690","192.168.1.1","172.23.69.13","TCP","8272","80 → 50034 [PSH, ACK] Seq=16234297 Ack=1 Win=1005 Len=8200 TSval=867144388 TSecr=2681681582"
"5870","7.032367","192.168.1.1","172.23.69.13","TCP","1520","80 → 50034 [ACK] Seq=16311001 Ack=1 Win=1005 Len=1448 TSval=867144421 TSecr=2681681609"
"5907","7.067518","192.168.1.1","172.23.69.13","TCP","8272","80 → 50034 [PSH, ACK] Seq=16386017 Ack=1 Win=1005 Len=8200 TSval=867144455 TSecr=2681681641"
"5926","7.102099","192.168.1.1","172.23.69.13","TCP","8272","80 → 50034 [PSH, ACK] Seq=16463929 Ack=1 Win=1005 Len=8200 TSval=867144488 TSecr=2681681675"
"5952","7.132116","192.168.1.1","172.23.69.13","TCP","4416","80 → 50034 [ACK] Seq=16541841 Ack=1 Win=1005 Len=4344 TSval=867144521 TSecr=2681681702"
"5981","7.165511","192.168.1.1","172.23.69.13","TCP","1520","80 → 50034 [ACK] Seq=16619753 Ack=1 Win=1005 Len=1448 TSval=867144555 TSecr=2681681736"
"6004","7.198761","192.168.1.1","172.23.69.13","TCP","1520","80 → 50034 [ACK] Seq=16697665 Ack=1 Win=1005 Len=1448 TSval=867144588 TSecr=2681681777"
"6024","7.232033","192.168.1.1","172.23.69.13","TCP","2968","80 → 50034 [ACK] Seq=16775577 Ack=1 Win=1005 Len=2896 TSval=867144621 TSecr=2681681805"
"6041","7.266046","192.168.1.1","172.23.69.13","TCP","8272","80 → 50034 [PSH, ACK] Seq=16849385 Ack=1 Win=1005 Len=8200 TSval=867144655 TSecr=2681681844"
"6070","7.315901","192.168.1.1","172.23.69.13","TCP","8272","80 → 50034 [PSH, ACK] Seq=16927297 Ack=1 Win=1005 Len=8200 TSval=867144688 TSecr=2681681869"
"6083","7.332295","192.168.1.1","172.23.69.13","TCP","2968","80 → 50034 [ACK] Seq=17005209 Ack=1 Win=1005 Len=2896 TSval=867144721 TSecr=2681681923"
"6109","7.365672","192.168.1.1","172.23.69.13","TCP","1520","80 → 50034 [ACK] Seq=17084569 Ack=1 Win=1005 Len=1448 TSval=867144755 TSecr=2681681954"
"6127","7.400050","192.168.1.1","172.23.69.13","TCP","8272","80 → 50034 [PSH, ACK] Seq=17161033 Ack=1 Win=1005 Len=8200 TSval=867144788 TSecr=2681681969"
"6150","7.432298","192.168.1.1","172.23.69.13","TCP","4416","80 → 50034 [ACK] Seq=17238945 Ack=1 Win=1005 Len=4344 TSval=867144821 TSecr=2681682006"
"6182","7.466064","192.168.1.1","172.23.69.13","TCP","8272","80 → 50034 [PSH, ACK] Seq=17316857 Ack=1 Win=1005 Len=8200 TSval=867144855 TSecr=2681682045"
"6197","7.509459","192.168.1.1","172.23.69.13","TCP","8272","80 → 50034 [PSH, ACK] Seq=17390665 Ack=1 Win=1005 Len=8200 TSval=867144888 TSecr=2681682069"
"6213","7.532954","192.168.1.1","172.23.69.13","TCP","8272","80 → 50034 [PSH, ACK] Seq=17468577 Ack=1 Win=1005 Len=8200 TSval=867144921 TSecr=2681682112"
"6232","7.565705","192.168.1.1","172.23.69.13","TCP","1520","80 → 50034 [ACK] Seq=17547937 Ack=1 Win=1005 Len=1448 TSval=867144955 TSecr=2681682150"
"6250","7.601754","192.168.1.1","172.23.69.13","TCP","8272","80 → 50034 [PSH, ACK] Seq=17624401 Ack=1 Win=1005 Len=8200 TSval=867144988 TSecr=2681682181"
"6273","7.633797","192.168.1.1","172.23.69.13","TCP","8272","80 → 50034 [PSH, ACK] Seq=17702313 Ack=1 Win=1005 Len=8200 TSval=867145021 TSecr=2681682203"
"6291","7.665739","192.168.1.1","172.23.69.13","TCP","1520","80 → 50034 [ACK] Seq=17780225 Ack=1 Win=1005 Len=1448 TSval=867145055 TSecr=2681682254"
"6322","7.703204","192.168.1.1","172.23.69.13","TCP","8272","80 → 50034 [PSH, ACK] Seq=17858137 Ack=1 Win=1005 Len=8200 TSval=867145088 TSecr=2681682276"
"6335","7.733246","192.168.1.1","172.23.69.13","TCP","8272","80 → 50034 [PSH, ACK] Seq=17931945 Ack=1 Win=1005 Len=8200 TSval=867145121 TSecr=2681682303"
"6348","7.766802","192.168.1.1","172.23.69.13","TCP","8272","80 → 50034 [PSH, ACK] Seq=18009857 Ack=1 Win=1005 Len=8200 TSval=867145155 TSecr=2681682348"
"6368","7.808025","192.168.1.1","172.23.69.13","TCP","8272","80 → 50034 [PSH, ACK] Seq=18087769 Ack=1 Win=1005 Len=8200 TSval=867145188 TSecr=2681682383"
"6381","7.834269","192.168.1.1","172.23.69.13","TCP","8272","80 → 50034 [PSH, ACK] Seq=18165681 Ack=1 Win=1005 Len=8200 TSval=867145221 TSecr=2681682411"
"6398","7.865693","192.168.1.1","172.23.69.13","TCP","2968","80 → 50034 [ACK] Seq=18245041 Ack=1 Win=1005 Len=2896 TSval=867145255 TSecr=2681682450"
"6443","7.899682","192.168.1.1","172.23.69.13","TCP","1520","80 → 50034 [ACK] Seq=18321505 Ack=1 Win=1005 Len=1448 TSval=867145288 TSecr=2681682471"
"6477","7.932176","192.168.1.1","172.23.69.13","TCP","1520","80 → 50034 [ACK] Seq=18399417 Ack=1 Win=1005 Len=1448 TSval=867145321 TSecr=2681682505"
"6497","7.965706","192.168.1.1","172.23.69.13","TCP","1520","80 → 50034 [ACK] Seq=18476121 Ack=1 Win=1005 Len=1448 TSval=867145355 TSecr=2681682536"
"6514","8.000351","192.168.1.1","172.23.69.13","TCP","4416","80 → 50034 [ACK] Seq=18552585 Ack=1 Win=1005 Len=4344 TSval=867145388 TSecr=2681682571"
"6559","8.032790","192.168.1.1","172.23.69.13","TCP","4416","80 → 50034 [ACK] Seq=18630497 Ack=1 Win=1005 Len=4344 TSval=867145421 TSecr=2681682603"
"6590","8.066014","192.168.1.1","172.23.69.13","TCP","5864","80 → 50034 [ACK] Seq=18708409 Ack=1 Win=1005 Len=5792 TSval=867145454 TSecr=2681682642"
"6616","8.099602","192.168.1.1","172.23.69.13","TCP","8272","80 → 50034 [PSH, ACK] Seq=18784873 Ack=1 Win=1005 Len=8200 TSval=867145488 TSecr=2681682670"
"6636","8.138785","192.168.1.1","172.23.69.13","TCP","8272","80 → 50034 [PSH, ACK] Seq=18862785 Ack=1 Win=1005 Len=8200 TSval=867145521 TSecr=2681682704"
"6649","8.166164","192.168.1.1","172.23.69.13","TCP","1520","80 → 50034 [ACK] Seq=18940697 Ack=1 Win=1005 Len=1448 TSval=867145555 TSecr=2681682747"
"6667","8.204585","192.168.1.1","172.23.69.13","TCP","8272","80 → 50034 [PSH, ACK] Seq=19018609 Ack=1 Win=1005 Len=8200 TSval=867145588 TSecr=2681682774"
"6684","8.232295","192.168.1.1","172.23.69.13","TCP","1520","80 → 50034 [ACK] Seq=19095313 Ack=1 Win=1005 Len=1448 TSval=867145621 TSecr=2681682802"
"6751","8.265929","192.168.1.1","172.23.69.13","TCP","5376","80 → 50034 [PSH, ACK] Seq=19173225 Ack=1 Win=1005 Len=5304 TSval=867145654 TSecr=2681682837"
"6773","8.299028","192.168.1.1","172.23.69.13","TCP","1520","80 → 50034 [ACK] Seq=19249689 Ack=1 Win=1005 Len=1448 TSval=867145688 TSecr=2681682871"
"6794","8.332490","192.168.1.1","172.23.69.13","TCP","2968","80 → 50034 [ACK] Seq=19327601 Ack=1 Win=1005 Len=2896 TSval=867145721 TSecr=2681682903"
"6827","8.367624","192.168.1.1","172.23.69.13","TCP","8272","80 → 50034 [PSH, ACK] Seq=19404065 Ack=1 Win=1005 Len=8200 TSval=867145755 TSecr=2681682939"
"6848","8.399322","192.168.1.1","172.23.69.13","TCP","4416","80 → 50034 [ACK] Seq=19481977 Ack=1 Win=1005 Len=4344 TSval=867145788 TSecr=2681682975"
"6864","8.433370","192.168.1.1","172.23.69.13","TCP","8272","80 → 50034 [PSH, ACK] Seq=19555785 Ack=1 Win=1005 Len=8200 TSval=867145821 TSecr=2681683005"
"6880","8.466516","192.168.1.1","172.23.69.13","TCP","8272","80 → 50034 [PSH, ACK] Seq=19633697 Ack=1 Win=1005 Len=8200 TSval=867145855 TSecr=2681683041"
"6901","8.499050","192.168.1.1","172.23.69.13","TCP","1520","80 → 50034 [ACK] Seq=19713057 Ack=1 Win=1005 Len=1448 TSval=867145888 TSecr=2681683078"
"6920","8.532382","192.168.1.1","172.23.69.13","TCP","1520","80 → 50034 [ACK] Seq=19790969 Ack=1 Win=1005 Len=1448 TSval=867145921 TSecr=2681683109"
"6973","8.565670","192.168.1.1","172.23.69.13","TCP","1520","80 → 50034 [ACK] Seq=19867433 Ack=1 Win=1005 Len=1448 TSval=867145955 TSecr=2681683140"
"7008","8.599615","192.168.1.1","172.23.69.13","TCP","1520","80 → 50034 [ACK] Seq=19945345 Ack=1 Win=1005 Len=1448 TSval=867145989 TSecr=2681683169"
"7030","8.632291","192.168.1.1","172.23.69.13","TCP","1520","80 → 50034 [ACK] Seq=20023257 Ack=1 Win=1005 Len=1448 TSval=867146021 TSecr=2681683211"
"7054","8.666572","192.168.1.1","172.23.69.13","TCP","6824","80 → 50034 [PSH, ACK] Seq=20098513 Ack=1 Win=1005 Len=6752 TSval=867146055 TSecr=2681683237"
"7082","8.700725","192.168.1.1","172.23.69.13","TCP","7312","80 → 50034 [ACK] Seq=20174977 Ack=1 Win=1005 Len=7240 TSval=867146089 TSecr=2681683270"
"7116","8.732270","192.168.1.1","172.23.69.13","TCP","1520","80 → 50034 [ACK] Seq=20254337 Ack=1 Win=1005 Len=1448 TSval=867146121 TSecr=2681683308"
"7136","8.766019","192.168.1.1","172.23.69.13","TCP","4416","80 → 50034 [ACK] Seq=20332249 Ack=1 Win=1005 Len=4344 TSval=867146155 TSecr=2681683336"
"7151","8.801465","192.168.1.1","172.23.69.13","TCP","8272","80 → 50034 [PSH, ACK] Seq=20408713 Ack=1 Win=1005 Len=8200 TSval=867146189 TSecr=2681683378"
